{"type":"rsp","id":7,"ok":true,"data":{"frames_total":128,"frames_ok":126,"frames_error":2,"inspect_compute_ms":{"count":128,"sum_ms":1536.000,"mean_ms":12.000,"buckets":[{"bucket_ms":0.5,"count":0},{"bucket_ms":1,"count":0},{"bucket_ms":2,"count":4},{"bucket_ms":5,"count":30},{"bucket_ms":10,"count":48},{"bucket_ms":20,"count":40},{"bucket_ms":50,"count":6},{"bucket_ms":100,"count":0},{"bucket_ms":200,"count":0},{"bucket_ms":500,"count":0},{"bucket_ms":1000,"count":0},{"bucket_ms":2000,"count":0},{"bucket_ms":5000,"count":0},{"bucket_ms":"inf","count":0}]}}}
